{"$defs":{"case":{"additionalProperties":false,"allOf":[{"if":{"properties":{"requestedObservationKind":{"const":"failure"}}},"then":{"properties":{"family":{"enum":["exact-chart","mesh-judgment"]}}}}],"properties":{"caseId":{"pattern":"^case-[0-9a-f]{16}$","type":"string"},"domainCaseIndex":{"$ref":"#/$defs/hex64"},"family":{"enum":["exact-chart","face-atom-covering","finite-surface-representation","certified-chord-bound","mesh-judgment"]},"globalCaseIndex":{"$ref":"#/$defs/hex64"},"requestedObservationKind":{"enum":["success","failure"]},"selectors":{"additionalProperties":{"$ref":"#/$defs/hex64"},"maxProperties":9,"minProperties":9,"propertyNames":{"enum":["value","familyParameter","observationClass","sign","multiplicity","intervalWidth","formulaVariant","mutation","reserved"]},"type":"object"}},"required":["caseId","domainCaseIndex","family","globalCaseIndex","requestedObservationKind","selectors"],"type":"object"},"hex64":{"pattern":"^[0-9a-f]{16}$","type":"string"}},"$schema":"https://json-schema.org/draft/2020-12/schema","additionalProperties":false,"properties":{"adapterRevision":{"const":"cad-generated-request-v2"},"cases":{"items":{"$ref":"#/$defs/case"},"maxItems":200,"minItems":1,"type":"array"},"domain":{"const":"neco.cad"},"generator":{"additionalProperties":false,"properties":{"algorithm":{"const":"splitmix64-v1"},"drawScheduleRevision":{"const":"draw-schedule-v1"},"seed":{"$ref":"#/$defs/hex64"}},"required":["algorithm","drawScheduleRevision","seed"],"type":"object"},"schema":{"const":"neco.verification.generated-request-batch.v1"}},"required":["adapterRevision","cases","domain","generator","schema"],"type":"object","x-invariants":["canonical UTF-8 JSON with sorted object keys, no whitespace or duplicate keys","caseId equals case- concatenated with globalCaseIndex","globalCaseIndex and domainCaseIndex independently unique within batch","adapter v2 normal exact-chart uses public exact-binary inverse-scale primitive extent and declared integer-center lattice applicability"]}