{"adapterRevision":"cad-generated-request-v2","cases":[{"caseId":"case-0000000000000000","domainCaseIndex":"0000000000000000","family":"exact-chart","globalCaseIndex":"0000000000000000","requestedObservationKind":"success","selectors":{"familyParameter":"0000000000000000","formulaVariant":"0000000000000000","intervalWidth":"0000000000000000","multiplicity":"0000000000000000","mutation":"0000000000000000","observationClass":"0000000000000000","reserved":"0000000000000000","sign":"0000000000000000","value":"0000000000000000"}},{"caseId":"case-0000000000000001","domainCaseIndex":"0000000000000001","family":"exact-chart","globalCaseIndex":"0000000000000001","requestedObservationKind":"success","selectors":{"familyParameter":"0000000000000001","formulaVariant":"0000000000000000","intervalWidth":"0000000000000000","multiplicity":"0000000000000001","mutation":"0000000000000000","observationClass":"0000000000000000","reserved":"0000000000000000","sign":"0000000000000001","value":"0000000000000001"}},{"caseId":"case-0000000000000002","domainCaseIndex":"0000000000000002","family":"exact-chart","globalCaseIndex":"0000000000000002","requestedObservationKind":"success","selectors":{"familyParameter":"0000000000000002","formulaVariant":"0000000000000000","intervalWidth":"0000000000000000","multiplicity":"0000000000000002","mutation":"0000000000000000","observationClass":"0000000000000000","reserved":"0000000000000000","sign":"0000000000000000","value":"0000000000000002"}},{"caseId":"case-0000000000000003","domainCaseIndex":"0000000000000003","family":"face-atom-covering","globalCaseIndex":"0000000000000003","requestedObservationKind":"success","selectors":{"familyParameter":"0000000000000000","formulaVariant":"0000000000000001","intervalWidth":"0000000000000000","multiplicity":"0000000000000000","mutation":"0000000000000000","observationClass":"0000000000000000","reserved":"0000000000000000","sign":"0000000000000000","value":"0000000000000003"}},{"caseId":"case-0000000000000004","domainCaseIndex":"0000000000000004","family":"finite-surface-representation","globalCaseIndex":"0000000000000004","requestedObservationKind":"success","selectors":{"familyParameter":"0000000000000000","formulaVariant":"0000000000000000","intervalWidth":"0000000000000000","multiplicity":"0000000000000000","mutation":"0000000000000000","observationClass":"0000000000000000","reserved":"0000000000000000","sign":"0000000000000000","value":"0000000000000004"}},{"caseId":"case-0000000000000005","domainCaseIndex":"0000000000000005","family":"certified-chord-bound","globalCaseIndex":"0000000000000005","requestedObservationKind":"success","selectors":{"familyParameter":"0000000000000000","formulaVariant":"0000000000000001","intervalWidth":"0000000000000000","multiplicity":"0000000000000000","mutation":"0000000000000000","observationClass":"0000000000000000","reserved":"0000000000000000","sign":"0000000000000000","value":"0000000000000005"}},{"caseId":"case-0000000000000006","domainCaseIndex":"0000000000000006","family":"mesh-judgment","globalCaseIndex":"0000000000000006","requestedObservationKind":"success","selectors":{"familyParameter":"0000000000000000","formulaVariant":"0000000000000000","intervalWidth":"0000000000000000","multiplicity":"0000000000000003","mutation":"0000000000000000","observationClass":"0000000000000000","reserved":"0000000000000000","sign":"0000000000000001","value":"0000000000000003"}}],"domain":"neco.cad","generator":{"algorithm":"splitmix64-v1","drawScheduleRevision":"draw-schedule-v1","seed":"9e3779b97f4a7c15"},"schema":"neco.verification.generated-request-batch.v1"}